============================= test session starts ==============================
platform darwin -- Python 3.12.12, pytest-9.0.1, pluggy-1.6.0 -- /Users/elliotmilco/Documents/GitHub/clams/.worktrees/SPEC-002-16/.venv/bin/python
cachedir: .pytest_cache
hypothesis profile 'default'
rootdir: /Users/elliotmilco/Documents/GitHub/clams/.worktrees/SPEC-002-16
configfile: pyproject.toml
testpaths: tests
plugins: mock-3.15.1, hypothesis-6.148.6, anyio-4.12.0, asyncio-1.3.0
asyncio: mode=Mode.AUTO, debug=False, asyncio_default_fixture_loop_scope=None, asyncio_default_test_loop_scope=function
collecting ... collected 470 items

tests/clustering/test_clusterer.py::test_cluster_basic PASSED
tests/clustering/test_clusterer.py::test_cluster_with_weights PASSED
tests/clustering/test_clusterer.py::test_cluster_empty PASSED
tests/clustering/test_clusterer.py::test_cluster_wrong_shape PASSED
tests/clustering/test_clusterer.py::test_cluster_weights_mismatch PASSED
tests/clustering/test_clusterer.py::test_cluster_single_cluster PASSED
tests/clustering/test_clusterer.py::test_compute_centroids PASSED
tests/clustering/test_clusterer.py::test_compute_centroids_excludes_noise PASSED
tests/clustering/test_clusterer.py::test_compute_centroids_weighted PASSED
tests/clustering/test_clusterer.py::test_compute_centroids_array_mismatch PASSED
tests/clustering/test_clusterer.py::test_compute_centroids_weights_mismatch PASSED
tests/clustering/test_clusterer.py::test_compute_centroids_no_weights PASSED
tests/clustering/test_clusterer.py::test_cluster_invariants PASSED
tests/clustering/test_clusterer.py::test_centroid_invariants PASSED
tests/clustering/test_clusterer.py::test_cluster_result_types PASSED
tests/clustering/test_clusterer.py::test_cluster_info_types PASSED
tests/clustering/test_experience.py::test_cluster_axis_success 2025-12-04 23:02:59 [info     ] clustering.complete            axis=full n_clusters=2 noise_count=10 total_points=20
PASSED
tests/clustering/test_experience.py::test_cluster_axis_invalid PASSED
tests/clustering/test_experience.py::test_cluster_axis_no_data PASSED
tests/clustering/test_experience.py::test_cluster_axis_with_weights 2025-12-04 23:02:59 [info     ] clustering.complete            axis=strategy n_clusters=2 noise_count=10 total_points=20
PASSED
tests/clustering/test_experience.py::test_cluster_axis_missing_tier 2025-12-04 23:02:59 [info     ] clustering.complete            axis=full n_clusters=2 noise_count=10 total_points=20
PASSED
tests/clustering/test_experience.py::test_cluster_axis_all_noise 2025-12-04 23:02:59 [warning  ] clustering.all_noise           axis=full message='HDBSCAN labeled all points as noise - no clusters found' noise_count=5 total_points=5
PASSED
tests/clustering/test_experience.py::test_cluster_all_axes 2025-12-04 23:02:59 [warning  ] clustering.all_noise           axis=full message='HDBSCAN labeled all points as noise - no clusters found' noise_count=10 total_points=10
2025-12-04 23:02:59 [warning  ] clustering.all_noise           axis=strategy message='HDBSCAN labeled all points as noise - no clusters found' noise_count=15 total_points=15
2025-12-04 23:02:59 [warning  ] clustering.axis_skipped        axis=surprise error="No embeddings found for axis 'surprise' (collection: experiences_surprise)" message='Skipping axis due to error'
2025-12-04 23:02:59 [warning  ] clustering.axis_skipped        axis=root_cause error="No embeddings found for axis 'root_cause' (collection: experiences_root_cause)" message='Skipping axis due to error'
PASSED
tests/clustering/test_experience.py::test_cluster_all_axes_all_empty 2025-12-04 23:02:59 [warning  ] clustering.axis_skipped        axis=full error="No embeddings found for axis 'full' (collection: experiences_full)" message='Skipping axis due to error'
2025-12-04 23:02:59 [warning  ] clustering.axis_skipped        axis=strategy error="No embeddings found for axis 'strategy' (collection: experiences_strategy)" message='Skipping axis due to error'
2025-12-04 23:02:59 [warning  ] clustering.axis_skipped        axis=surprise error="No embeddings found for axis 'surprise' (collection: experiences_surprise)" message='Skipping axis due to error'
2025-12-04 23:02:59 [warning  ] clustering.axis_skipped        axis=root_cause error="No embeddings found for axis 'root_cause' (collection: experiences_root_cause)" message='Skipping axis due to error'
PASSED
tests/clustering/test_experience.py::test_cluster_axis_calls_correct_collection 2025-12-04 23:02:59 [info     ] clustering.complete            axis=full n_clusters=2 noise_count=10 total_points=20
2025-12-04 23:02:59 [info     ] clustering.complete            axis=strategy n_clusters=2 noise_count=10 total_points=20
2025-12-04 23:02:59 [info     ] clustering.complete            axis=surprise n_clusters=2 noise_count=10 total_points=20
2025-12-04 23:02:59 [info     ] clustering.complete            axis=root_cause n_clusters=2 noise_count=10 total_points=20
PASSED
tests/clustering/test_experience.py::test_cluster_axis_scroll_limit_warning 2025-12-04 23:02:59 [warning  ] clustering.scroll_limit_reached axis=full collection=experiences_full count=10000 message='May have truncated results - consider pagination'
2025-12-04 23:03:09 [info     ] clustering.complete            axis=full n_clusters=358 noise_count=8166 total_points=10000
PASSED
tests/clustering/test_integration.py::test_end_to_end_clustering 2025-12-04 23:03:09 [warning  ] clustering.all_noise           axis=full message='HDBSCAN labeled all points as noise - no clusters found' noise_count=50 total_points=50
PASSED
tests/clustering/test_integration.py::test_multi_axis_clustering 2025-12-04 23:03:09 [warning  ] clustering.all_noise           axis=full message='HDBSCAN labeled all points as noise - no clusters found' noise_count=30 total_points=30
2025-12-04 23:03:09 [warning  ] clustering.all_noise           axis=strategy message='HDBSCAN labeled all points as noise - no clusters found' noise_count=30 total_points=30
PASSED
tests/clustering/test_integration.py::test_clustering_with_mixed_confidence_tiers 2025-12-04 23:03:09 [warning  ] clustering.all_noise           axis=full message='HDBSCAN labeled all points as noise - no clusters found' noise_count=16 total_points=16
PASSED
tests/clustering/test_integration.py::test_clustering_performance 2025-12-04 23:03:10 [info     ] clustering.complete            axis=full n_clusters=3 noise_count=318 total_points=500
PASSED
tests/clustering/test_integration.py::test_clustering_empty_collection PASSED
tests/clustering/test_types.py::test_confidence_weights_mapping PASSED
tests/clustering/test_types.py::test_get_weight_valid_tiers PASSED
tests/clustering/test_types.py::test_get_weight_case_insensitive PASSED
tests/clustering/test_types.py::test_get_weight_none PASSED
tests/clustering/test_types.py::test_get_weight_invalid PASSED
tests/context/test_assembler.py::test_assemble_single_source_memories 2025-12-04 23:03:10 [info     ] assembling_context             component=context_assembler context_types=['memories'] limit=20 max_tokens=1000 query='coding preferences'
2025-12-04 23:03:10 [info     ] deduplication_complete         component=context_assembler deduplicated_count=1 original_count=1
2025-12-04 23:03:10 [debug    ] source_budget_used             budget=1000 component=context_assembler items_selected=1 source=memories unused=983 used=17
2025-12-04 23:03:10 [debug    ] redistributing_unused_budget   component=context_assembler total_unused=983
PASSED
tests/context/test_assembler.py::test_assemble_multiple_sources 2025-12-04 23:03:10 [info     ] assembling_context             component=context_assembler context_types=['memories', 'code'] limit=20 max_tokens=2000 query='python examples'
2025-12-04 23:03:10 [info     ] deduplication_complete         component=context_assembler deduplicated_count=2 original_count=2
2025-12-04 23:03:10 [debug    ] source_budget_used             budget=666 component=context_assembler items_selected=1 source=memories unused=649 used=17
2025-12-04 23:03:10 [debug    ] source_budget_used             budget=1333 component=context_assembler items_selected=1 source=code unused=1308 used=25
2025-12-04 23:03:10 [debug    ] redistributing_unused_budget   component=context_assembler total_unused=1957
PASSED
tests/context/test_assembler.py::test_invalid_context_type PASSED
tests/context/test_assembler.py::test_empty_results 2025-12-04 23:03:10 [info     ] assembling_context             component=context_assembler context_types=['memories', 'code'] limit=20 max_tokens=1000 query=nothing
2025-12-04 23:03:10 [info     ] deduplication_complete         component=context_assembler deduplicated_count=0 original_count=0
PASSED
tests/context/test_assembler.py::test_token_budget_distribution 2025-12-04 23:03:10 [info     ] assembling_context             component=context_assembler context_types=['memories'] limit=20 max_tokens=500 query=test
2025-12-04 23:03:10 [info     ] deduplication_complete         component=context_assembler deduplicated_count=8 original_count=8
2025-12-04 23:03:10 [debug    ] source_budget_used             budget=500 component=context_assembler items_selected=8 source=memories unused=354 used=146
2025-12-04 23:03:10 [debug    ] redistributing_unused_budget   component=context_assembler total_unused=354
PASSED
tests/context/test_assembler.py::test_deduplication 2025-12-04 23:03:10 [info     ] assembling_context             component=context_assembler context_types=['experiences', 'values'] limit=20 max_tokens=2000 query=test
2025-12-04 23:03:10 [info     ] deduplication_complete         component=context_assembler deduplicated_count=1 original_count=2
2025-12-04 23:03:10 [debug    ] source_budget_used             budget=500 component=context_assembler items_selected=1 source=values unused=487 used=13
2025-12-04 23:03:10 [debug    ] redistributing_unused_budget   component=context_assembler total_unused=487
PASSED
tests/context/test_assembler.py::test_premortem_context 2025-12-04 23:03:10 [info     ] assembling_premortem           component=context_assembler domain=debugging limit=10 strategy=systematic
PASSED
tests/context/test_assembler.py::test_premortem_partial_failure 2025-12-04 23:03:10 [info     ] assembling_premortem           component=context_assembler domain=debugging limit=10 strategy=None
2025-12-04 23:03:10 [warning  ] premortem_query_partial_failure component=context_assembler error='Surprise axis failed' query_index=1
PASSED
tests/context/test_assembler.py::test_partial_source_failure 2025-12-04 23:03:10 [info     ] assembling_context             component=context_assembler context_types=['memories', 'code'] limit=20 max_tokens=2000 query=test
2025-12-04 23:03:10 [warning  ] source_query_partial_failure   component=context_assembler error='Code search failed' source=code
2025-12-04 23:03:10 [info     ] deduplication_complete         component=context_assembler deduplicated_count=1 original_count=1
2025-12-04 23:03:10 [debug    ] source_budget_used             budget=666 component=context_assembler items_selected=1 source=memories unused=652 used=14
2025-12-04 23:03:10 [debug    ] redistributing_unused_budget   component=context_assembler total_unused=652
PASSED
tests/context/test_deduplication.py::test_deduplicate_items_empty PASSED
tests/context/test_deduplication.py::test_deduplicate_items_no_duplicates PASSED
tests/context/test_deduplication.py::test_deduplicate_items_by_ghap_id PASSED
tests/context/test_deduplication.py::test_deduplicate_items_by_file_path PASSED
tests/context/test_deduplication.py::test_deduplicate_items_by_sha PASSED
tests/context/test_deduplication.py::test_deduplicate_items_by_memory_id PASSED
tests/context/test_deduplication.py::test_deduplicate_items_fuzzy_match PASSED
tests/context/test_deduplication.py::test_deduplicate_items_fuzzy_no_match PASSED
tests/context/test_deduplication.py::test_deduplicate_items_sorted_by_relevance PASSED
tests/context/test_deduplication.py::test_deduplicate_items_skips_long_content PASSED
tests/context/test_formatting.py::test_format_memory PASSED
tests/context/test_formatting.py::test_format_code PASSED
tests/context/test_formatting.py::test_format_code_no_docstring PASSED
tests/context/test_formatting.py::test_format_experience PASSED
tests/context/test_formatting.py::test_format_experience_no_optional_fields PASSED
tests/context/test_formatting.py::test_format_value PASSED
tests/context/test_formatting.py::test_format_commit PASSED
tests/context/test_formatting.py::test_format_commit_many_files PASSED
tests/context/test_formatting.py::test_assemble_markdown_standard PASSED
tests/context/test_formatting.py::test_assemble_markdown_empty_sources PASSED
tests/context/test_formatting.py::test_assemble_markdown_premortem PASSED
tests/context/test_formatting.py::test_assemble_markdown_premortem_no_strategy PASSED
tests/context/test_tokens.py::test_estimate_tokens_basic PASSED
tests/context/test_tokens.py::test_estimate_tokens_empty PASSED
tests/context/test_tokens.py::test_truncate_to_tokens_no_truncation PASSED
tests/context/test_tokens.py::test_truncate_to_tokens_truncates PASSED
tests/context/test_tokens.py::test_truncate_to_tokens_prefers_newline PASSED
tests/context/test_tokens.py::test_distribute_budget_single_source PASSED
tests/context/test_tokens.py::test_distribute_budget_multiple_sources PASSED
tests/context/test_tokens.py::test_distribute_budget_all_sources PASSED
tests/context/test_tokens.py::test_cap_item_tokens_no_cap PASSED
tests/context/test_tokens.py::test_cap_item_tokens_applies_cap PASSED
tests/context/test_tokens.py::test_cap_item_tokens_code_note PASSED
tests/context/test_tokens.py::test_cap_item_tokens_experience_note PASSED
tests/embedding/test_mock.py::TestMockEmbedding::test_dimension PASSED
tests/embedding/test_mock.py::TestMockEmbedding::test_embed_returns_correct_shape PASSED
tests/embedding/test_mock.py::TestMockEmbedding::test_embed_deterministic PASSED
tests/embedding/test_mock.py::TestMockEmbedding::test_embed_different_texts_produce_different_embeddings PASSED
tests/embedding/test_mock.py::TestMockEmbedding::test_embed_normalized PASSED
tests/embedding/test_mock.py::TestMockEmbedding::test_embed_batch_empty_list PASSED
tests/embedding/test_mock.py::TestMockEmbedding::test_embed_batch_single_item PASSED
tests/embedding/test_mock.py::TestMockEmbedding::test_embed_batch_multiple_items PASSED
tests/embedding/test_mock.py::TestMockEmbedding::test_embed_batch_consistency_with_embed PASSED
tests/embedding/test_mock.py::TestMockEmbedding::test_embed_handles_special_characters PASSED
tests/embedding/test_mock.py::TestMockEmbedding::test_embed_long_text PASSED
tests/embedding/test_nomic.py::TestNomicEmbedding::test_dimension PASSED
tests/embedding/test_nomic.py::TestNomicEmbedding::test_embed_returns_correct_shape PASSED
tests/embedding/test_nomic.py::TestNomicEmbedding::test_embed_multiple_calls PASSED
tests/embedding/test_nomic.py::TestNomicEmbedding::test_embed_batch_empty_list PASSED
tests/embedding/test_nomic.py::TestNomicEmbedding::test_embed_batch_single_item PASSED
tests/embedding/test_nomic.py::TestNomicEmbedding::test_embed_batch_multiple_items PASSED
tests/embedding/test_nomic.py::TestNomicEmbedding::test_custom_settings PASSED
tests/embedding/test_nomic.py::TestNomicEmbedding::test_invalid_model_raises_error PASSED
tests/git/test_analyzer.py::TestGitAnalyzer::test_index_commits_initial 2025-12-04 23:03:32 [info     ] full_index_starting            force=False has_state=False repo_path=/private/var/folders/kw/rp67pf8d5ng588lqp7d_gb240000gn/T/tmpu8w7ps9q
PASSED
tests/git/test_analyzer.py::TestGitAnalyzer::test_index_commits_incremental 2025-12-04 23:03:33 [info     ] full_index_starting            force=False has_state=False repo_path=/private/var/folders/kw/rp67pf8d5ng588lqp7d_gb240000gn/T/tmpj6d4yhtx
2025-12-04 23:03:33 [info     ] incremental_index_starting     new_commits=1 repo_path=/private/var/folders/kw/rp67pf8d5ng588lqp7d_gb240000gn/T/tmpj6d4yhtx
PASSED
tests/git/test_analyzer.py::TestGitAnalyzer::test_index_commits_already_up_to_date 2025-12-04 23:03:34 [info     ] full_index_starting            force=False has_state=False repo_path=/private/var/folders/kw/rp67pf8d5ng588lqp7d_gb240000gn/T/tmpsuj_wu3u
2025-12-04 23:03:34 [info     ] index_already_up_to_date       repo_path=/private/var/folders/kw/rp67pf8d5ng588lqp7d_gb240000gn/T/tmpsuj_wu3u
PASSED
tests/git/test_analyzer.py::TestGitAnalyzer::test_index_commits_force_reindex 2025-12-04 23:03:34 [info     ] full_index_starting            force=False has_state=False repo_path=/private/var/folders/kw/rp67pf8d5ng588lqp7d_gb240000gn/T/tmpqlow3q_p
2025-12-04 23:03:34 [info     ] full_index_starting            force=True has_state=True repo_path=/private/var/folders/kw/rp67pf8d5ng588lqp7d_gb240000gn/T/tmpqlow3q_p
PASSED
tests/git/test_analyzer.py::TestGitAnalyzer::test_index_commits_with_limit 2025-12-04 23:03:34 [info     ] full_index_starting            force=False has_state=False repo_path=/private/var/folders/kw/rp67pf8d5ng588lqp7d_gb240000gn/T/tmp06z3qaya
PASSED
tests/git/test_analyzer.py::TestGitAnalyzer::test_index_commits_five_year_limit 2025-12-04 23:03:35 [info     ] full_index_starting            force=False has_state=False repo_path=/private/var/folders/kw/rp67pf8d5ng588lqp7d_gb240000gn/T/tmpda01kzst
PASSED
tests/git/test_analyzer.py::TestGitAnalyzer::test_search_commits 2025-12-04 23:03:35 [info     ] full_index_starting            force=False has_state=False repo_path=/private/var/folders/kw/rp67pf8d5ng588lqp7d_gb240000gn/T/tmpib71cn0c
PASSED
tests/git/test_analyzer.py::TestGitAnalyzer::test_search_commits_with_author_filter 2025-12-04 23:03:35 [info     ] full_index_starting            force=False has_state=False repo_path=/private/var/folders/kw/rp67pf8d5ng588lqp7d_gb240000gn/T/tmp8ux533gr
PASSED
tests/git/test_analyzer.py::TestGitAnalyzer::test_search_commits_with_date_filter 2025-12-04 23:03:36 [info     ] full_index_starting            force=False has_state=False repo_path=/private/var/folders/kw/rp67pf8d5ng588lqp7d_gb240000gn/T/tmp6kzevwu_
PASSED
tests/git/test_analyzer.py::TestGitAnalyzer::test_get_churn_hotspots PASSED
tests/git/test_analyzer.py::TestGitAnalyzer::test_get_file_authors PASSED
tests/git/test_analyzer.py::TestGitAnalyzer::test_get_change_frequency PASSED
tests/git/test_analyzer.py::TestGitAnalyzer::test_get_change_frequency_nonexistent_file PASSED
tests/git/test_analyzer.py::TestGitAnalyzer::test_blame_search PASSED
tests/git/test_analyzer.py::TestGitAnalyzer::test_blame_search_with_file_pattern PASSED
tests/git/test_analyzer.py::TestGitAnalyzer::test_embedding_text_format PASSED
tests/git/test_analyzer.py::TestGitAnalyzer::test_embedding_text_truncation PASSED
tests/git/test_analyzer.py::TestGitAnalyzer::test_index_state_tracking 2025-12-04 23:03:38 [info     ] full_index_starting            force=False has_state=False repo_path=/private/var/folders/kw/rp67pf8d5ng588lqp7d_gb240000gn/T/tmpdbmi0rzs
PASSED
tests/git/test_analyzer.py::TestGitAnalyzer::test_batch_embedding_performance 2025-12-04 23:03:38 [info     ] full_index_starting            force=False has_state=False repo_path=/private/var/folders/kw/rp67pf8d5ng588lqp7d_gb240000gn/T/tmplrls46o7
PASSED
tests/git/test_analyzer.py::test_integration_with_real_repo 2025-12-04 23:03:39 [info     ] full_index_starting            force=False has_state=False repo_path=/Users/elliotmilco/Documents/GitHub/clams/.worktrees/SPEC-002-16
PASSED
tests/git/test_reader.py::TestGitPythonReader::test_init_with_valid_repo PASSED
tests/git/test_reader.py::TestGitPythonReader::test_init_with_invalid_repo PASSED
tests/git/test_reader.py::TestGitPythonReader::test_init_with_nonexistent_path PASSED
tests/git/test_reader.py::TestGitPythonReader::test_get_commits_empty_repo PASSED
tests/git/test_reader.py::TestGitPythonReader::test_get_commits_single_commit PASSED
tests/git/test_reader.py::TestGitPythonReader::test_get_commits_multiple_commits PASSED
tests/git/test_reader.py::TestGitPythonReader::test_get_commits_with_limit PASSED
tests/git/test_reader.py::TestGitPythonReader::test_get_commits_with_path_filter PASSED
tests/git/test_reader.py::TestGitPythonReader::test_get_commits_with_date_filter PASSED
tests/git/test_reader.py::TestGitPythonReader::test_get_blame_text_file PASSED
tests/git/test_reader.py::TestGitPythonReader::test_get_blame_nonexistent_file PASSED
tests/git/test_reader.py::TestGitPythonReader::test_get_blame_binary_file PASSED
tests/git/test_reader.py::TestGitPythonReader::test_get_file_history PASSED
tests/git/test_reader.py::TestGitPythonReader::test_get_head_sha PASSED
tests/git/test_reader.py::TestGitPythonReader::test_get_head_sha_empty_repo PASSED
tests/git/test_reader.py::TestGitPythonReader::test_commit_timezone_aware PASSED
tests/git/test_reader.py::TestGitPythonReader::test_blame_timezone_aware PASSED
tests/git/test_reader.py::TestGitPythonReader::test_files_changed_relative_paths PASSED
tests/git/test_reader.py::test_integration_with_real_repo PASSED
tests/hooks/test_mcp_client.py::TestMCPClient::test_init PASSED
tests/hooks/test_mcp_client.py::TestMCPClient::test_connect_success PASSED
tests/hooks/test_mcp_client.py::TestMCPClient::test_connect_timeout 2025-12-04 23:03:52 [warning  ] mcp_client.connect_failed      error='TestMCPClient.test_connect_timeout.<locals>.slow_connect() takes 0 positional arguments but 1 was given'
PASSED
tests/hooks/test_mcp_client.py::TestMCPClient::test_connect_exception 2025-12-04 23:03:52 [warning  ] mcp_client.connect_failed      error='Connection failed'
PASSED
tests/hooks/test_mcp_client.py::TestMCPClient::test_call_tool_not_connected 2025-12-04 23:03:52 [warning  ] mcp_client.not_connected
PASSED
tests/hooks/test_mcp_client.py::TestMCPClient::test_call_tool_success PASSED
tests/hooks/test_mcp_client.py::TestMCPClient::test_call_tool_empty_content PASSED
tests/hooks/test_mcp_client.py::TestMCPClient::test_call_tool_invalid_json 2025-12-04 23:03:52 [error    ] mcp_client.invalid_json        error='Expecting value: line 1 column 1 (char 0)' tool=test_tool
PASSED
tests/hooks/test_mcp_client.py::TestMCPClient::test_call_tool_timeout 2025-12-04 23:03:52 [warning  ] mcp_client.call_failed         error= tool=slow_tool
PASSED
tests/hooks/test_mcp_client.py::TestMCPClient::test_call_tool_exception 2025-12-04 23:03:52 [warning  ] mcp_client.call_failed         error='Tool call failed' tool=test_tool
PASSED
tests/hooks/test_mcp_client.py::TestMCPClient::test_close_with_session PASSED
tests/hooks/test_mcp_client.py::TestMCPClient::test_close_without_session PASSED
tests/hooks/test_mcp_client.py::TestMainCLI::test_main_invalid_args PASSED
tests/hooks/test_mcp_client.py::TestMainCLI::test_main_invalid_json_args PASSED
tests/hooks/test_mcp_client.py::TestMainCLI::test_main_connection_failed PASSED
tests/hooks/test_mcp_client.py::TestMainCLI::test_main_success PASSED
tests/indexers/test_indexer.py::test_index_single_file 2025-12-04 23:03:52 [info     ] collection_created             name=code_units
2025-12-04 23:03:52 [debug    ] file_units_deleted             count=0 path=/Users/elliotmilco/Documents/GitHub/clams/.worktrees/SPEC-002-16/tests/fixtures/code_samples/sample.py project=test_project
PASSED
tests/indexers/test_indexer.py::test_index_file_twice_skips_second 2025-12-04 23:03:52 [info     ] collection_created             name=code_units
2025-12-04 23:03:52 [debug    ] file_units_deleted             count=0 path=/Users/elliotmilco/Documents/GitHub/clams/.worktrees/SPEC-002-16/tests/fixtures/code_samples/sample.py project=test_project
2025-12-04 23:03:52 [info     ] file_skipped                   path=/Users/elliotmilco/Documents/GitHub/clams/.worktrees/SPEC-002-16/tests/fixtures/code_samples/sample.py reason=no_changes
PASSED
tests/indexers/test_indexer.py::test_index_directory 2025-12-04 23:03:52 [info     ] collection_created             name=code_units
2025-12-04 23:03:52 [debug    ] file_units_deleted             count=0 path=/Users/elliotmilco/Documents/GitHub/clams/.worktrees/SPEC-002-16/tests/fixtures/code_samples/malformed.py project=test_project
2025-12-04 23:03:52 [debug    ] file_units_deleted             count=0 path=/Users/elliotmilco/Documents/GitHub/clams/.worktrees/SPEC-002-16/tests/fixtures/code_samples/sample.swift project=test_project
2025-12-04 23:03:52 [debug    ] file_units_deleted             count=0 path=/Users/elliotmilco/Documents/GitHub/clams/.worktrees/SPEC-002-16/tests/fixtures/code_samples/sample.ts project=test_project
2025-12-04 23:03:52 [debug    ] file_units_deleted             count=0 path=/Users/elliotmilco/Documents/GitHub/clams/.worktrees/SPEC-002-16/tests/fixtures/code_samples/sample.java project=test_project
2025-12-04 23:03:52 [debug    ] file_units_deleted             count=0 path=/Users/elliotmilco/Documents/GitHub/clams/.worktrees/SPEC-002-16/tests/fixtures/code_samples/sample.cpp project=test_project
2025-12-04 23:03:52 [debug    ] file_units_deleted             count=0 path=/Users/elliotmilco/Documents/GitHub/clams/.worktrees/SPEC-002-16/tests/fixtures/code_samples/sample.c project=test_project
2025-12-04 23:03:52 [debug    ] file_units_deleted             count=0 path=/Users/elliotmilco/Documents/GitHub/clams/.worktrees/SPEC-002-16/tests/fixtures/code_samples/sample.py project=test_project
2025-12-04 23:03:52 [debug    ] file_units_deleted             count=0 path=/Users/elliotmilco/Documents/GitHub/clams/.worktrees/SPEC-002-16/tests/fixtures/code_samples/sample.rs project=test_project
2025-12-04 23:03:52 [debug    ] file_units_deleted             count=0 path=/Users/elliotmilco/Documents/GitHub/clams/.worktrees/SPEC-002-16/tests/fixtures/code_samples/sample.js project=test_project
PASSED
tests/indexers/test_indexer.py::test_remove_file 2025-12-04 23:03:52 [info     ] collection_created             name=code_units
2025-12-04 23:03:52 [debug    ] file_units_deleted             count=0 path=/Users/elliotmilco/Documents/GitHub/clams/.worktrees/SPEC-002-16/tests/fixtures/code_samples/sample.py project=test_project
2025-12-04 23:03:52 [debug    ] file_units_deleted             count=7 path=/Users/elliotmilco/Documents/GitHub/clams/.worktrees/SPEC-002-16/tests/fixtures/code_samples/sample.py project=test_project
2025-12-04 23:03:52 [info     ] file_removed                   path=/Users/elliotmilco/Documents/GitHub/clams/.worktrees/SPEC-002-16/tests/fixtures/code_samples/sample.py project=test_project units_removed=7
PASSED
tests/indexers/test_indexer.py::test_remove_project 2025-12-04 23:03:52 [info     ] collection_created             name=code_units
2025-12-04 23:03:52 [debug    ] file_units_deleted             count=0 path=/Users/elliotmilco/Documents/GitHub/clams/.worktrees/SPEC-002-16/tests/fixtures/code_samples/sample.py project=test_project
2025-12-04 23:03:52 [debug    ] file_units_deleted             count=0 path=/Users/elliotmilco/Documents/GitHub/clams/.worktrees/SPEC-002-16/tests/fixtures/code_samples/sample.ts project=test_project
2025-12-04 23:03:52 [debug    ] file_units_deleted             count=7 path=/Users/elliotmilco/Documents/GitHub/clams/.worktrees/SPEC-002-16/tests/fixtures/code_samples/sample.py project=test_project
2025-12-04 23:03:52 [debug    ] file_units_deleted             count=5 path=/Users/elliotmilco/Documents/GitHub/clams/.worktrees/SPEC-002-16/tests/fixtures/code_samples/sample.ts project=test_project
2025-12-04 23:03:52 [info     ] project_removed                files_count=2 project=test_project
PASSED
tests/indexers/test_indexer.py::test_reindex_prevents_orphans 2025-12-04 23:03:52 [info     ] collection_created             name=code_units
2025-12-04 23:03:52 [debug    ] file_units_deleted             count=0 path=/var/folders/kw/rp67pf8d5ng588lqp7d_gb240000gn/T/tmp4649163s.py project=test_project
2025-12-04 23:03:52 [debug    ] file_units_deleted             count=3 path=/var/folders/kw/rp67pf8d5ng588lqp7d_gb240000gn/T/tmp4649163s.py project=test_project
PASSED
tests/indexers/test_indexer.py::test_empty_file_handling 2025-12-04 23:03:52 [info     ] collection_created             name=code_units
PASSED
tests/indexers/test_indexer.py::test_error_accumulation 2025-12-04 23:03:52 [info     ] collection_created             name=code_units
2025-12-04 23:03:52 [debug    ] file_units_deleted             count=0 path=/Users/elliotmilco/Documents/GitHub/clams/.worktrees/SPEC-002-16/tests/fixtures/code_samples/malformed.py project=test_project
PASSED
tests/indexers/test_indexer.py::test_exclude_patterns 2025-12-04 23:03:52 [info     ] collection_created             name=code_units
2025-12-04 23:03:52 [debug    ] file_units_deleted             count=0 path=/Users/elliotmilco/Documents/GitHub/clams/.worktrees/SPEC-002-16/tests/fixtures/code_samples/sample.swift project=test_project
2025-12-04 23:03:52 [debug    ] file_units_deleted             count=0 path=/Users/elliotmilco/Documents/GitHub/clams/.worktrees/SPEC-002-16/tests/fixtures/code_samples/sample.ts project=test_project
2025-12-04 23:03:52 [debug    ] file_units_deleted             count=0 path=/Users/elliotmilco/Documents/GitHub/clams/.worktrees/SPEC-002-16/tests/fixtures/code_samples/sample.java project=test_project
2025-12-04 23:03:52 [debug    ] file_units_deleted             count=0 path=/Users/elliotmilco/Documents/GitHub/clams/.worktrees/SPEC-002-16/tests/fixtures/code_samples/sample.cpp project=test_project
2025-12-04 23:03:52 [debug    ] file_units_deleted             count=0 path=/Users/elliotmilco/Documents/GitHub/clams/.worktrees/SPEC-002-16/tests/fixtures/code_samples/sample.c project=test_project
2025-12-04 23:03:52 [debug    ] file_units_deleted             count=0 path=/Users/elliotmilco/Documents/GitHub/clams/.worktrees/SPEC-002-16/tests/fixtures/code_samples/sample.py project=test_project
2025-12-04 23:03:52 [debug    ] file_units_deleted             count=0 path=/Users/elliotmilco/Documents/GitHub/clams/.worktrees/SPEC-002-16/tests/fixtures/code_samples/sample.rs project=test_project
2025-12-04 23:03:52 [debug    ] file_units_deleted             count=0 path=/Users/elliotmilco/Documents/GitHub/clams/.worktrees/SPEC-002-16/tests/fixtures/code_samples/sample.js project=test_project
PASSED
tests/indexers/test_indexer.py::test_get_indexing_stats 2025-12-04 23:03:52 [info     ] collection_created             name=code_units
2025-12-04 23:03:52 [debug    ] file_units_deleted             count=0 path=/Users/elliotmilco/Documents/GitHub/clams/.worktrees/SPEC-002-16/tests/fixtures/code_samples/sample.py project=project1
2025-12-04 23:03:52 [debug    ] file_units_deleted             count=0 path=/Users/elliotmilco/Documents/GitHub/clams/.worktrees/SPEC-002-16/tests/fixtures/code_samples/sample.ts project=project1
2025-12-04 23:03:52 [debug    ] file_units_deleted             count=0 path=/Users/elliotmilco/Documents/GitHub/clams/.worktrees/SPEC-002-16/tests/fixtures/code_samples/sample.js project=project2
PASSED
tests/indexers/test_tree_sitter.py::test_language_detection PASSED
tests/indexers/test_tree_sitter.py::test_supported_languages PASSED
tests/indexers/test_tree_sitter.py::test_parse_python PASSED
tests/indexers/test_tree_sitter.py::test_parse_typescript PASSED
tests/indexers/test_tree_sitter.py::test_parse_javascript PASSED
tests/indexers/test_tree_sitter.py::test_parse_lua SKIPPED (Lua parser
not available on PyPI)
tests/indexers/test_tree_sitter.py::test_parse_rust PASSED
tests/indexers/test_tree_sitter.py::test_parse_java PASSED
tests/indexers/test_tree_sitter.py::test_parse_c PASSED
tests/indexers/test_tree_sitter.py::test_parse_cpp PASSED
tests/indexers/test_tree_sitter.py::test_parse_swift PASSED
tests/indexers/test_tree_sitter.py::test_parse_sql SKIPPED (SQL parsing
is complex and not MVP critical)
tests/indexers/test_tree_sitter.py::test_parse_empty_file PASSED
tests/indexers/test_tree_sitter.py::test_parse_malformed_file PASSED
tests/observation/test_collector.py::test_create_ghap 2025-12-04 23:03:52 [info     ] session_started                session_id=session_20251205_040352_58a293
2025-12-04 23:03:52 [debug    ] ghap_saved                     ghap_id=ghap_20251205_040352_18d57b
2025-12-04 23:03:52 [info     ] ghap_created                   domain=debugging ghap_id=ghap_20251205_040352_18d57b strategy=systematic-elimination
PASSED
tests/observation/test_collector.py::test_create_ghap_auto_starts_session 2025-12-04 23:03:52 [info     ] session_started                session_id=session_20251205_040352_080bf2
2025-12-04 23:03:52 [debug    ] ghap_saved                     ghap_id=ghap_20251205_040352_198e65
2025-12-04 23:03:52 [info     ] ghap_created                   domain=debugging ghap_id=ghap_20251205_040352_198e65 strategy=systematic-elimination
PASSED
tests/observation/test_collector.py::test_create_ghap_when_active_raises 2025-12-04 23:03:52 [info     ] session_started                session_id=session_20251205_040352_11bff9
2025-12-04 23:03:52 [debug    ] ghap_saved                     ghap_id=ghap_20251205_040352_f73699
2025-12-04 23:03:52 [info     ] ghap_created                   domain=debugging ghap_id=ghap_20251205_040352_f73699 strategy=systematic-elimination
2025-12-04 23:03:52 [warning  ] ghap_already_active            current_id=ghap_20251205_040352_f73699
PASSED
tests/observation/test_collector.py::test_update_ghap_changes_hypothesis 2025-12-04 23:03:52 [info     ] session_started                session_id=session_20251205_040352_745105
2025-12-04 23:03:52 [debug    ] ghap_saved                     ghap_id=ghap_20251205_040352_6a109f
2025-12-04 23:03:52 [info     ] ghap_created                   domain=debugging ghap_id=ghap_20251205_040352_6a109f strategy=systematic-elimination
2025-12-04 23:03:52 [debug    ] ghap_saved                     ghap_id=ghap_20251205_040352_6a109f
2025-12-04 23:03:52 [info     ] ghap_updated                   ghap_id=ghap_20251205_040352_6a109f hap_changed=True iteration=2
PASSED
tests/observation/test_collector.py::test_update_ghap_changes_all_hap 2025-12-04 23:03:52 [info     ] session_started                session_id=session_20251205_040352_bd8817
2025-12-04 23:03:52 [debug    ] ghap_saved                     ghap_id=ghap_20251205_040352_066043
2025-12-04 23:03:52 [info     ] ghap_created                   domain=debugging ghap_id=ghap_20251205_040352_066043 strategy=systematic-elimination
2025-12-04 23:03:52 [debug    ] ghap_saved                     ghap_id=ghap_20251205_040352_066043
2025-12-04 23:03:52 [info     ] ghap_updated                   ghap_id=ghap_20251205_040352_066043 hap_changed=True iteration=2
PASSED
tests/observation/test_collector.py::test_update_ghap_note_only 2025-12-04 23:03:52 [info     ] session_started                session_id=session_20251205_040352_38851e
2025-12-04 23:03:52 [debug    ] ghap_saved                     ghap_id=ghap_20251205_040352_73a9fc
2025-12-04 23:03:52 [info     ] ghap_created                   domain=debugging ghap_id=ghap_20251205_040352_73a9fc strategy=systematic-elimination
2025-12-04 23:03:52 [debug    ] ghap_saved                     ghap_id=ghap_20251205_040352_73a9fc
2025-12-04 23:03:52 [info     ] ghap_updated                   ghap_id=ghap_20251205_040352_73a9fc hap_changed=False iteration=1
PASSED
tests/observation/test_collector.py::test_update_ghap_strategy_only 2025-12-04 23:03:52 [info     ] session_started                session_id=session_20251205_040352_6ecfb5
2025-12-04 23:03:52 [debug    ] ghap_saved                     ghap_id=ghap_20251205_040352_58658e
2025-12-04 23:03:52 [info     ] ghap_created                   domain=debugging ghap_id=ghap_20251205_040352_58658e strategy=systematic-elimination
2025-12-04 23:03:52 [debug    ] ghap_saved                     ghap_id=ghap_20251205_040352_58658e
2025-12-04 23:03:52 [info     ] ghap_updated                   ghap_id=ghap_20251205_040352_58658e hap_changed=False iteration=1
PASSED
tests/observation/test_collector.py::test_update_ghap_no_active_raises 2025-12-04 23:03:52 [warning  ] no_active_ghap_for_update
PASSED
tests/observation/test_collector.py::test_resolve_ghap_confirmed 2025-12-04 23:03:52 [info     ] session_started                session_id=session_20251205_040352_38204d
2025-12-04 23:03:52 [debug    ] ghap_saved                     ghap_id=ghap_20251205_040352_3b18db
2025-12-04 23:03:52 [info     ] ghap_created                   domain=debugging ghap_id=ghap_20251205_040352_3b18db strategy=systematic-elimination
2025-12-04 23:03:52 [info     ] ghap_resolved                  ghap_id=ghap_20251205_040352_3b18db iterations=1 status=confirmed tier=silver
PASSED
tests/observation/test_collector.py::test_resolve_ghap_auto_captured_gold 2025-12-04 23:03:52 [info     ] session_started                session_id=session_20251205_040352_a08f37
2025-12-04 23:03:52 [debug    ] ghap_saved                     ghap_id=ghap_20251205_040352_04e1bb
2025-12-04 23:03:52 [info     ] ghap_created                   domain=debugging ghap_id=ghap_20251205_040352_04e1bb strategy=systematic-elimination
2025-12-04 23:03:52 [info     ] ghap_resolved                  ghap_id=ghap_20251205_040352_04e1bb iterations=1 status=confirmed tier=gold
PASSED
tests/observation/test_collector.py::test_abandon_ghap 2025-12-04 23:03:52 [info     ] session_started                session_id=session_20251205_040352_e2de6a
2025-12-04 23:03:52 [debug    ] ghap_saved                     ghap_id=ghap_20251205_040352_a1b917
2025-12-04 23:03:52 [info     ] ghap_created                   domain=debugging ghap_id=ghap_20251205_040352_a1b917 strategy=systematic-elimination
2025-12-04 23:03:52 [info     ] ghap_resolved                  ghap_id=ghap_20251205_040352_a1b917 iterations=1 status=abandoned tier=abandoned
PASSED
tests/observation/test_collector.py::test_start_session 2025-12-04 23:03:52 [info     ] session_started                session_id=session_20251205_040352_850895
PASSED
tests/observation/test_collector.py::test_start_session_archives_previous 2025-12-04 23:03:52 [info     ] session_started                session_id=session_20251205_040352_e6032a
2025-12-04 23:03:52 [debug    ] ghap_saved                     ghap_id=ghap_20251205_040352_d8ab08
2025-12-04 23:03:52 [info     ] ghap_created                   domain=debugging ghap_id=ghap_20251205_040352_d8ab08 strategy=systematic-elimination
2025-12-04 23:03:52 [info     ] ghap_resolved                  ghap_id=ghap_20251205_040352_d8ab08 iterations=1 status=confirmed tier=silver
2025-12-04 23:03:52 [info     ] session_archived               archive_file=20251205_session_20251205_040352_e6032a.jsonl entry_count=1 session_id=session_20251205_040352_e6032a
2025-12-04 23:03:52 [info     ] session_started                session_id=session_20251205_040352_70c463
PASSED
tests/observation/test_collector.py::test_end_session 2025-12-04 23:03:52 [info     ] session_started                session_id=session_20251205_040352_1dd7b7
2025-12-04 23:03:52 [debug    ] ghap_saved                     ghap_id=ghap_20251205_040352_a4d8cd
2025-12-04 23:03:52 [info     ] ghap_created                   domain=debugging ghap_id=ghap_20251205_040352_a4d8cd strategy=systematic-elimination
2025-12-04 23:03:52 [info     ] ghap_resolved                  ghap_id=ghap_20251205_040352_a4d8cd iterations=1 status=confirmed tier=silver
2025-12-04 23:03:52 [info     ] session_archived               archive_file=20251205_session_20251205_040352_1dd7b7.jsonl entry_count=1 session_id=session_20251205_040352_1dd7b7
2025-12-04 23:03:52 [info     ] session_ended                  entries_archived=1 session_id=session_20251205_040352_1dd7b7
PASSED
tests/observation/test_collector.py::test_end_session_abandons_current 2025-12-04 23:03:52 [info     ] session_started                session_id=session_20251205_040352_18bd1e
2025-12-04 23:03:52 [debug    ] ghap_saved                     ghap_id=ghap_20251205_040352_37bfe9
2025-12-04 23:03:52 [info     ] ghap_created                   domain=debugging ghap_id=ghap_20251205_040352_37bfe9 strategy=systematic-elimination
2025-12-04 23:03:52 [info     ] ghap_resolved                  ghap_id=ghap_20251205_040352_37bfe9 iterations=1 status=abandoned tier=abandoned
2025-12-04 23:03:52 [info     ] session_archived               archive_file=20251205_session_20251205_040352_18bd1e.jsonl entry_count=1 session_id=session_20251205_040352_18bd1e
2025-12-04 23:03:52 [info     ] session_ended                  entries_archived=1 session_id=session_20251205_040352_18bd1e
PASSED
tests/observation/test_collector.py::test_has_orphaned_entry 2025-12-04 23:03:52 [info     ] session_started                session_id=session_20251205_040352_51db66
2025-12-04 23:03:52 [debug    ] ghap_saved                     ghap_id=ghap_20251205_040352_fd1934
2025-12-04 23:03:52 [info     ] ghap_created                   domain=debugging ghap_id=ghap_20251205_040352_fd1934 strategy=systematic-elimination
2025-12-04 23:03:52 [info     ] session_started                session_id=session_20251205_040352_3bdd2b
PASSED
tests/observation/test_collector.py::test_adopt_orphan 2025-12-04 23:03:52 [info     ] session_started                session_id=session_20251205_040352_5c12fa
2025-12-04 23:03:52 [debug    ] ghap_saved                     ghap_id=ghap_20251205_040352_d2435d
2025-12-04 23:03:52 [info     ] ghap_created                   domain=debugging ghap_id=ghap_20251205_040352_d2435d strategy=systematic-elimination
2025-12-04 23:03:52 [info     ] session_started                session_id=session_20251205_040352_53786c
2025-12-04 23:03:52 [debug    ] ghap_saved                     ghap_id=ghap_20251205_040352_d2435d
2025-12-04 23:03:52 [info     ] orphan_adopted                 ghap_id=ghap_20251205_040352_d2435d new_session_id=session_20251205_040352_53786c
PASSED
tests/observation/test_collector.py::test_abandon_orphan 2025-12-04 23:03:52 [info     ] session_started                session_id=session_20251205_040352_555180
2025-12-04 23:03:52 [debug    ] ghap_saved                     ghap_id=ghap_20251205_040352_43ffb9
2025-12-04 23:03:52 [info     ] ghap_created                   domain=debugging ghap_id=ghap_20251205_040352_43ffb9 strategy=systematic-elimination
2025-12-04 23:03:52 [info     ] session_started                session_id=session_20251205_040352_8358be
2025-12-04 23:03:52 [info     ] entry_archived_to_session      archive_file=20251205_session_20251205_040352_555180.jsonl ghap_id=ghap_20251205_040352_43ffb9 session_id=session_20251205_040352_555180
2025-12-04 23:03:52 [info     ] orphan_abandoned               ghap_id=ghap_20251205_040352_43ffb9 original_session_id=session_20251205_040352_555180
PASSED
tests/observation/test_collector.py::test_increment_tool_count PASSED
tests/observation/test_collector.py::test_should_check_in 2025-12-04 23:03:52 [info     ] session_started                session_id=session_20251205_040352_86d9ab
2025-12-04 23:03:52 [debug    ] ghap_saved                     ghap_id=ghap_20251205_040352_d8fdd8
2025-12-04 23:03:52 [info     ] ghap_created                   domain=debugging ghap_id=ghap_20251205_040352_d8fdd8 strategy=systematic-elimination
PASSED
tests/observation/test_collector.py::test_reset_tool_count PASSED
tests/observation/test_collector.py::test_tool_count_persists PASSED
tests/observation/test_collector.py::test_full_session_lifecycle 2025-12-04 23:03:52 [info     ] session_started                session_id=session_20251205_040352_e29910
2025-12-04 23:03:52 [debug    ] ghap_saved                     ghap_id=ghap_20251205_040352_3f96e1
2025-12-04 23:03:52 [info     ] ghap_created                   domain=debugging ghap_id=ghap_20251205_040352_3f96e1 strategy=systematic-elimination
2025-12-04 23:03:52 [info     ] ghap_resolved                  ghap_id=ghap_20251205_040352_3f96e1 iterations=1 status=confirmed tier=silver
2025-12-04 23:03:52 [debug    ] ghap_saved                     ghap_id=ghap_20251205_040352_6519d2
2025-12-04 23:03:52 [info     ] ghap_created                   domain=debugging ghap_id=ghap_20251205_040352_6519d2 strategy=systematic-elimination
2025-12-04 23:03:52 [info     ] ghap_resolved                  ghap_id=ghap_20251205_040352_6519d2 iterations=1 status=confirmed tier=silver
2025-12-04 23:03:52 [debug    ] ghap_saved                     ghap_id=ghap_20251205_040352_3df221
2025-12-04 23:03:52 [info     ] ghap_created                   domain=debugging ghap_id=ghap_20251205_040352_3df221 strategy=systematic-elimination
2025-12-04 23:03:52 [info     ] ghap_resolved                  ghap_id=ghap_20251205_040352_3df221 iterations=1 status=confirmed tier=silver
2025-12-04 23:03:52 [info     ] session_archived               archive_file=20251205_session_20251205_040352_e29910.jsonl entry_count=3 session_id=session_20251205_040352_e29910
2025-12-04 23:03:52 [info     ] session_ended                  entries_archived=3 session_id=session_20251205_040352_e29910
PASSED
tests/observation/test_collector.py::test_state_survives_restart 2025-12-04 23:03:52 [info     ] session_started                session_id=session_20251205_040352_f1c148
2025-12-04 23:03:52 [debug    ] ghap_saved                     ghap_id=ghap_20251205_040352_2c7eab
2025-12-04 23:03:52 [info     ] ghap_created                   domain=debugging ghap_id=ghap_20251205_040352_2c7eab strategy=systematic-elimination
PASSED
tests/observation/test_collector.py::test_multiple_iterations 2025-12-04 23:03:52 [info     ] session_started                session_id=session_20251205_040352_7b9d4b
2025-12-04 23:03:52 [debug    ] ghap_saved                     ghap_id=ghap_20251205_040352_3bc0bb
2025-12-04 23:03:52 [info     ] ghap_created                   domain=debugging ghap_id=ghap_20251205_040352_3bc0bb strategy=systematic-elimination
2025-12-04 23:03:52 [debug    ] ghap_saved                     ghap_id=ghap_20251205_040352_3bc0bb
2025-12-04 23:03:52 [info     ] ghap_updated                   ghap_id=ghap_20251205_040352_3bc0bb hap_changed=True iteration=2
2025-12-04 23:03:52 [debug    ] ghap_saved                     ghap_id=ghap_20251205_040352_3bc0bb
2025-12-04 23:03:52 [info     ] ghap_updated                   ghap_id=ghap_20251205_040352_3bc0bb hap_changed=True iteration=3
PASSED
tests/observation/test_collector.py::test_text_truncation 2025-12-04 23:03:52 [info     ] session_started                session_id=session_20251205_040352_84257d
2025-12-04 23:03:52 [warning  ] text_truncated                 max_len=10000 original_len=15000
2025-12-04 23:03:52 [debug    ] ghap_saved                     ghap_id=ghap_20251205_040352_34e2f8
2025-12-04 23:03:52 [info     ] ghap_created                   domain=debugging ghap_id=ghap_20251205_040352_34e2f8 strategy=systematic-elimination
PASSED
tests/observation/test_collector.py::test_corrupted_current_ghap_recovery 2025-12-04 23:03:52 [info     ] session_started                session_id=session_20251205_040352_9742ba
2025-12-04 23:03:52 [debug    ] ghap_saved                     ghap_id=ghap_20251205_040352_2345ba
2025-12-04 23:03:52 [info     ] ghap_created                   domain=debugging ghap_id=ghap_20251205_040352_2345ba strategy=systematic-elimination
2025-12-04 23:03:52 [error    ] corrupted_ghap_backed_up       backup=/private/var/folders/kw/rp67pf8d5ng588lqp7d_gb240000gn/T/pytest-of-elliotmilco/pytest-598/test_corrupted_current_ghap_re0/journal/current_ghap.corrupted.1764907432 error='Expecting value: line 1 column 1 (char 0)' file=/private/var/folders/kw/rp67pf8d5ng588lqp7d_gb240000gn/T/pytest-of-elliotmilco/pytest-598/test_corrupted_current_ghap_re0/journal/current_ghap.json
PASSED
tests/observation/test_collector.py::test_corrupted_session_entries_recovery 2025-12-04 23:03:52 [info     ] session_started                session_id=session_20251205_040352_75b6fc
2025-12-04 23:03:52 [debug    ] ghap_saved                     ghap_id=ghap_20251205_040352_0e778e
2025-12-04 23:03:52 [info     ] ghap_created                   domain=debugging ghap_id=ghap_20251205_040352_0e778e strategy=systematic-elimination
2025-12-04 23:03:52 [info     ] ghap_resolved                  ghap_id=ghap_20251205_040352_0e778e iterations=1 status=confirmed tier=silver
2025-12-04 23:03:52 [debug    ] ghap_saved                     ghap_id=ghap_20251205_040352_1ecae2
2025-12-04 23:03:52 [info     ] ghap_created                   domain=debugging ghap_id=ghap_20251205_040352_1ecae2 strategy=systematic-elimination
2025-12-04 23:03:52 [info     ] ghap_resolved                  ghap_id=ghap_20251205_040352_1ecae2 iterations=1 status=confirmed tier=silver
2025-12-04 23:03:52 [warning  ] corrupt_entry_skipped          error='Expecting value: line 1 column 1 (char 0)' line_num=2
PASSED
tests/observation/test_models.py::test_root_cause_serialization PASSED
tests/observation/test_models.py::test_lesson_serialization PASSED
tests/observation/test_models.py::test_lesson_optional_takeaway PASSED
tests/observation/test_models.py::test_history_entry_serialization PASSED
tests/observation/test_models.py::test_outcome_serialization PASSED
tests/observation/test_models.py::test_ghap_entry_minimal_serialization PASSED
tests/observation/test_models.py::test_ghap_entry_full_serialization PASSED
tests/observation/test_models.py::test_domain_enum_values PASSED
tests/observation/test_models.py::test_strategy_enum_values PASSED
tests/observation/test_models.py::test_outcome_status_enum_values PASSED
tests/observation/test_models.py::test_confidence_tier_enum_values PASSED
tests/observation/test_utils.py::test_generate_ghap_id PASSED
tests/observation/test_utils.py::test_generate_ghap_id_uniqueness PASSED
tests/observation/test_utils.py::test_generate_session_id PASSED
tests/observation/test_utils.py::test_generate_session_id_uniqueness PASSED
tests/observation/test_utils.py::test_compute_confidence_tier_abandoned PASSED
tests/observation/test_utils.py::test_compute_confidence_tier_gold PASSED
tests/observation/test_utils.py::test_compute_confidence_tier_silver PASSED
tests/observation/test_utils.py::test_compute_confidence_tier_no_outcome PASSED
tests/observation/test_utils.py::test_atomic_write PASSED
tests/observation/test_utils.py::test_atomic_write_overwrites_existing PASSED
tests/observation/test_utils.py::test_atomic_write_cleans_up_temp_on_error PASSED
tests/observation/test_utils.py::test_truncate_text_short PASSED
tests/observation/test_utils.py::test_truncate_text_exact_limit PASSED
tests/observation/test_utils.py::test_truncate_text_too_long 2025-12-04 23:03:52 [warning  ] text_truncated                 max_len=100 original_len=200
PASSED
tests/observation/test_utils.py::test_truncate_text_unicode 2025-12-04 23:03:52 [warning  ] text_truncated                 max_len=50 original_len=1000
PASSED
tests/search/test_results.py::TestMemoryResult::test_from_search_result_with_all_fields PASSED
tests/search/test_results.py::TestMemoryResult::test_from_search_result_with_optional_fields_none PASSED
tests/search/test_results.py::TestCodeResult::test_from_search_result_with_all_fields PASSED
tests/search/test_results.py::TestCodeResult::test_from_search_result_without_docstring PASSED
tests/search/test_results.py::TestExperienceResult::test_from_search_result_with_all_fields PASSED
tests/search/test_results.py::TestExperienceResult::test_from_search_result_without_optional_nested_objects PASSED
tests/search/test_results.py::TestValueResult::test_from_search_result PASSED
tests/search/test_results.py::TestCommitResult::test_from_search_result PASSED
tests/search/test_searcher.py::TestSearchMemories::test_calls_embed_with_query PASSED
tests/search/test_searcher.py::TestSearchMemories::test_calls_vector_store_with_correct_collection PASSED
tests/search/test_searcher.py::TestSearchMemories::test_applies_category_filter PASSED
tests/search/test_searcher.py::TestSearchMemories::test_empty_query_returns_empty_list PASSED
tests/search/test_searcher.py::TestSearchMemories::test_invalid_search_mode_raises_error PASSED
tests/search/test_searcher.py::TestSearchMemories::test_embedding_failure_raises_embedding_error PASSED
tests/search/test_searcher.py::TestSearchMemories::test_collection_not_found_raises_error PASSED
tests/search/test_searcher.py::TestSearchMemories::test_maps_results_correctly PASSED
tests/search/test_searcher.py::TestSearchCode::test_calls_embed_with_query PASSED
tests/search/test_searcher.py::TestSearchCode::test_calls_vector_store_with_correct_collection PASSED
tests/search/test_searcher.py::TestSearchCode::test_applies_multiple_filters PASSED
tests/search/test_searcher.py::TestSearchCode::test_maps_results_correctly PASSED
tests/search/test_searcher.py::TestSearchExperiences::test_calls_embed_with_query PASSED
tests/search/test_searcher.py::TestSearchExperiences::test_selects_correct_collection_for_axis PASSED
tests/search/test_searcher.py::TestSearchExperiences::test_invalid_axis_raises_error PASSED
tests/search/test_searcher.py::TestSearchExperiences::test_applies_domain_and_outcome_filters PASSED
tests/search/test_searcher.py::TestSearchExperiences::test_maps_results_with_nested_dataclasses PASSED
tests/search/test_searcher.py::TestSearchValues::test_calls_embed_with_query PASSED
tests/search/test_searcher.py::TestSearchValues::test_calls_vector_store_with_correct_collection PASSED
tests/search/test_searcher.py::TestSearchValues::test_default_limit_is_5 PASSED
tests/search/test_searcher.py::TestSearchValues::test_maps_results_correctly PASSED
tests/search/test_searcher.py::TestSearchCommits::test_calls_embed_with_query PASSED
tests/search/test_searcher.py::TestSearchCommits::test_calls_vector_store_with_correct_collection PASSED
tests/search/test_searcher.py::TestSearchCommits::test_applies_author_and_date_filters PASSED
tests/search/test_searcher.py::TestSearchCommits::test_maps_results_correctly PASSED
tests/search/test_searcher.py::TestCollectionName::test_experience_axis_mapping PASSED
tests/search/test_searcher.py::TestCollectionName::test_invalid_axis_raises_error PASSED
tests/server/test_config.py::test_default_settings PASSED
tests/server/test_config.py::test_env_override PASSED
tests/server/test_config.py::test_settings_immutable PASSED
tests/server/test_main.py::test_create_server 2025-12-04 23:03:52 [info     ] services.initializing
2025-12-04 23:03:56 [info     ] code.initialized
2025-12-04 23:03:56 [info     ] git.init_skipped               reason=no_repo_path
2025-12-04 23:03:56 [info     ] services.initialized           has_code=True has_git=False has_searcher=False
2025-12-04 23:03:56 [info     ] tools.registered               has_code=True has_git=False has_searcher=False
2025-12-04 23:03:56 [info     ] server.created                 server_name=learning-memory-server
PASSED
tests/server/test_main.py::test_server_has_ping_tool 2025-12-04 23:03:56 [info     ] services.initializing
2025-12-04 23:03:59 [info     ] code.initialized
2025-12-04 23:03:59 [info     ] git.init_skipped               reason=no_repo_path
2025-12-04 23:03:59 [info     ] services.initialized           has_code=True has_git=False has_searcher=False
2025-12-04 23:03:59 [info     ] tools.registered               has_code=True has_git=False has_searcher=False
2025-12-04 23:03:59 [info     ] server.created                 server_name=learning-memory-server
PASSED
tests/server/tools/test_code.py::test_index_codebase_not_available 2025-12-04 23:03:59 [info     ] code.index                     directory=/tmp project=test
PASSED
tests/server/tools/test_code.py::test_search_code_not_available 2025-12-04 23:03:59 [info     ] code.search                    project=None query=test
PASSED
tests/server/tools/test_code.py::test_find_similar_code_not_available 2025-12-04 23:03:59 [info     ] code.find_similar              snippet_len=9
PASSED
tests/server/tools/test_code.py::test_search_code_empty_query 2025-12-04 23:03:59 [info     ] code.search                    project=None query='   '
PASSED
tests/server/tools/test_code.py::test_search_code_limit_validation 2025-12-04 23:03:59 [info     ] code.search                    project=None query=test
2025-12-04 23:03:59 [info     ] code.search                    project=None query=test
PASSED
tests/server/tools/test_code.py::test_find_similar_code_snippet_too_long 2025-12-04 23:03:59 [info     ] code.find_similar              snippet_len=6000
PASSED
tests/server/tools/test_code.py::test_find_similar_code_empty_snippet 2025-12-04 23:03:59 [info     ] code.find_similar              snippet_len=3
PASSED
tests/server/tools/test_code.py::test_find_similar_code_limit_validation 2025-12-04 23:03:59 [info     ] code.find_similar              snippet_len=4
2025-12-04 23:03:59 [info     ] code.find_similar              snippet_len=4
PASSED
tests/server/tools/test_code.py::test_index_codebase_directory_not_found 2025-12-04 23:03:59 [info     ] code.index                     directory=/private/var/folders/kw/rp67pf8d5ng588lqp7d_gb240000gn/T/pytest-of-elliotmilco/pytest-598/test_index_codebase_directory_0/nonexistent project=test
PASSED
tests/server/tools/test_code.py::test_index_codebase_not_a_directory 2025-12-04 23:03:59 [info     ] code.index                     directory=/private/var/folders/kw/rp67pf8d5ng588lqp7d_gb240000gn/T/pytest-of-elliotmilco/pytest-598/test_index_codebase_not_a_dire0/test.txt project=test
PASSED
tests/server/tools/test_code.py::test_search_code_with_filters 2025-12-04 23:03:59 [info     ] code.search                    project=test-project query='test function'
2025-12-04 23:03:59 [info     ] code.searched                  count=1
PASSED
tests/server/tools/test_code.py::test_find_similar_code_with_project_filter 2025-12-04 23:03:59 [info     ] code.find_similar              snippet_len=16
2025-12-04 23:03:59 [info     ] code.similar_found             count=0
PASSED
tests/server/tools/test_enums.py::TestDomains::test_valid_domains PASSED
tests/server/tools/test_enums.py::TestDomains::test_invalid_domain_raises_error PASSED
tests/server/tools/test_enums.py::TestDomains::test_error_message_includes_valid_options PASSED
tests/server/tools/test_enums.py::TestStrategies::test_valid_strategies PASSED
tests/server/tools/test_enums.py::TestStrategies::test_invalid_strategy_raises_error PASSED
tests/server/tools/test_enums.py::TestStrategies::test_error_message_includes_valid_options PASSED
tests/server/tools/test_enums.py::TestAxes::test_valid_axes PASSED
tests/server/tools/test_enums.py::TestAxes::test_invalid_axis_raises_error PASSED
tests/server/tools/test_enums.py::TestAxes::test_error_message_includes_valid_options PASSED
tests/server/tools/test_enums.py::TestAxes::test_domain_is_not_a_valid_axis PASSED
tests/server/tools/test_enums.py::TestOutcomeStatus::test_valid_outcome_statuses PASSED
tests/server/tools/test_enums.py::TestOutcomeStatus::test_invalid_outcome_status_raises_error PASSED
tests/server/tools/test_enums.py::TestOutcomeStatus::test_error_message_includes_valid_options PASSED
tests/server/tools/test_enums.py::TestRootCauseCategories::test_valid_root_cause_categories PASSED
tests/server/tools/test_enums.py::TestRootCauseCategories::test_invalid_root_cause_category_raises_error PASSED
tests/server/tools/test_enums.py::TestRootCauseCategories::test_error_message_includes_valid_options PASSED
tests/server/tools/test_errors.py::test_mcp_error_is_exception PASSED
tests/server/tools/test_errors.py::test_validation_error_is_mcp_error PASSED
tests/server/tools/test_errors.py::test_not_found_error_is_mcp_error PASSED
tests/server/tools/test_errors.py::test_insufficient_data_error_is_mcp_error PASSED
tests/server/tools/test_errors.py::test_errors_can_be_raised PASSED
tests/server/tools/test_ghap.py::TestStartGhap::test_start_ghap_success 2025-12-04 23:04:00 [info     ] session_started                session_id=session_20251205_040359_35b136
2025-12-04 23:04:00 [debug    ] ghap_saved                     ghap_id=ghap_20251205_040400_391f41
2025-12-04 23:04:00 [info     ] ghap_created                   domain=debugging ghap_id=ghap_20251205_040400_391f41 strategy=systematic-elimination
2025-12-04 23:04:00 [info     ] ghap.started                   domain=debugging ghap_id=ghap_20251205_040400_391f41 strategy=systematic-elimination
PASSED
tests/server/tools/test_ghap.py::TestStartGhap::test_start_ghap_invalid_domain 2025-12-04 23:04:00 [warning  ] ghap.validation_error          error="Invalid domain 'invalid'. Valid options: debugging, refactoring, feature, testing, configuration, documentation, performance, security, integration"
PASSED
tests/server/tools/test_ghap.py::TestStartGhap::test_start_ghap_invalid_strategy 2025-12-04 23:04:00 [warning  ] ghap.validation_error          error="Invalid strategy 'invalid'. Valid options: systematic-elimination, trial-and-error, research-first, divide-and-conquer, root-cause-analysis, copy-from-similar, check-assumptions, read-the-error, ask-user"
PASSED
tests/server/tools/test_ghap.py::TestStartGhap::test_start_ghap_empty_field 2025-12-04 23:04:00 [warning  ] ghap.validation_error          error="Field 'goal' cannot be empty"
PASSED
tests/server/tools/test_ghap.py::TestStartGhap::test_start_ghap_field_too_long 2025-12-04 23:04:00 [warning  ] ghap.validation_error          error="Field 'goal' exceeds 1000 character limit (1001 chars)"
PASSED
tests/server/tools/test_ghap.py::TestUpdateGhap::test_update_ghap_success 2025-12-04 23:04:00 [info     ] session_started                session_id=session_20251205_040400_54eacf
2025-12-04 23:04:00 [debug    ] ghap_saved                     ghap_id=ghap_20251205_040400_2e6cb2
2025-12-04 23:04:00 [info     ] ghap_created                   domain=debugging ghap_id=ghap_20251205_040400_2e6cb2 strategy=systematic-elimination
2025-12-04 23:04:00 [info     ] ghap.started                   domain=debugging ghap_id=ghap_20251205_040400_2e6cb2 strategy=systematic-elimination
2025-12-04 23:04:00 [debug    ] ghap_saved                     ghap_id=ghap_20251205_040400_2e6cb2
2025-12-04 23:04:00 [info     ] ghap_updated                   ghap_id=ghap_20251205_040400_2e6cb2 hap_changed=True iteration=2
2025-12-04 23:04:00 [info     ] ghap.updated                   ghap_id=ghap_20251205_040400_2e6cb2 iteration_count=2
PASSED
tests/server/tools/test_ghap.py::TestUpdateGhap::test_update_ghap_no_active_entry 2025-12-04 23:04:00 [warning  ] ghap.error                     error='No active GHAP entry to update. Use start_ghap to begin tracking.'
PASSED
tests/server/tools/test_ghap.py::TestUpdateGhap::test_update_ghap_field_too_long 2025-12-04 23:04:00 [info     ] session_started                session_id=session_20251205_040400_0f29a3
2025-12-04 23:04:00 [debug    ] ghap_saved                     ghap_id=ghap_20251205_040400_dac458
2025-12-04 23:04:00 [info     ] ghap_created                   domain=debugging ghap_id=ghap_20251205_040400_dac458 strategy=systematic-elimination
2025-12-04 23:04:00 [info     ] ghap.started                   domain=debugging ghap_id=ghap_20251205_040400_dac458 strategy=systematic-elimination
2025-12-04 23:04:00 [warning  ] ghap.error                     error="Field 'hypothesis' exceeds 1000 character limit (1001 chars)"
PASSED
tests/server/tools/test_ghap.py::TestResolveGhap::test_resolve_ghap_confirmed 2025-12-04 23:04:00 [info     ] session_started                session_id=session_20251205_040400_a82748
2025-12-04 23:04:00 [debug    ] ghap_saved                     ghap_id=ghap_20251205_040400_d5cb49
2025-12-04 23:04:00 [info     ] ghap_created                   domain=debugging ghap_id=ghap_20251205_040400_d5cb49 strategy=systematic-elimination
2025-12-04 23:04:00 [info     ] ghap.started                   domain=debugging ghap_id=ghap_20251205_040400_d5cb49 strategy=systematic-elimination
2025-12-04 23:04:00 [info     ] ghap_resolved                  ghap_id=ghap_20251205_040400_d5cb49 iterations=1 status=confirmed tier=silver
2025-12-04 23:04:00 [info     ] ghap.persisted                 attempt=1 ghap_id=ghap_20251205_040400_d5cb49
PASSED
tests/server/tools/test_ghap.py::TestResolveGhap::test_resolve_ghap_falsified 2025-12-04 23:04:00 [info     ] session_started                session_id=session_20251205_040400_76951e
2025-12-04 23:04:00 [debug    ] ghap_saved                     ghap_id=ghap_20251205_040400_13b591
2025-12-04 23:04:00 [info     ] ghap_created                   domain=debugging ghap_id=ghap_20251205_040400_13b591 strategy=systematic-elimination
2025-12-04 23:04:00 [info     ] ghap.started                   domain=debugging ghap_id=ghap_20251205_040400_13b591 strategy=systematic-elimination
2025-12-04 23:04:00 [info     ] ghap_resolved                  ghap_id=ghap_20251205_040400_13b591 iterations=1 status=falsified tier=silver
2025-12-04 23:04:00 [info     ] ghap.persisted                 attempt=1 ghap_id=ghap_20251205_040400_13b591
PASSED
tests/server/tools/test_ghap.py::TestResolveGhap::test_resolve_ghap_falsified_missing_surprise 2025-12-04 23:04:00 [info     ] session_started                session_id=session_20251205_040400_563951
2025-12-04 23:04:00 [debug    ] ghap_saved                     ghap_id=ghap_20251205_040400_b093d0
2025-12-04 23:04:00 [info     ] ghap_created                   domain=debugging ghap_id=ghap_20251205_040400_b093d0 strategy=systematic-elimination
2025-12-04 23:04:00 [info     ] ghap.started                   domain=debugging ghap_id=ghap_20251205_040400_b093d0 strategy=systematic-elimination
2025-12-04 23:04:00 [warning  ] ghap.error                     error="Field 'surprise' is required when status is 'falsified'"
PASSED
tests/server/tools/test_ghap.py::TestResolveGhap::test_resolve_ghap_invalid_status 2025-12-04 23:04:00 [info     ] session_started                session_id=session_20251205_040400_c36b9a
2025-12-04 23:04:00 [debug    ] ghap_saved                     ghap_id=ghap_20251205_040400_8ccb51
2025-12-04 23:04:00 [info     ] ghap_created                   domain=debugging ghap_id=ghap_20251205_040400_8ccb51 strategy=systematic-elimination
2025-12-04 23:04:00 [info     ] ghap.started                   domain=debugging ghap_id=ghap_20251205_040400_8ccb51 strategy=systematic-elimination
2025-12-04 23:04:00 [warning  ] ghap.error                     error="Invalid outcome status 'invalid'. Valid options: confirmed, falsified, abandoned"
PASSED
tests/server/tools/test_ghap.py::TestGetActiveGhap::test_get_active_ghap_with_entry 2025-12-04 23:04:00 [info     ] session_started                session_id=session_20251205_040400_3dcc15
2025-12-04 23:04:00 [debug    ] ghap_saved                     ghap_id=ghap_20251205_040400_eb13fb
2025-12-04 23:04:00 [info     ] ghap_created                   domain=debugging ghap_id=ghap_20251205_040400_eb13fb strategy=systematic-elimination
2025-12-04 23:04:00 [info     ] ghap.started                   domain=debugging ghap_id=ghap_20251205_040400_eb13fb strategy=systematic-elimination
PASSED
tests/server/tools/test_ghap.py::TestGetActiveGhap::test_get_active_ghap_no_entry PASSED
tests/server/tools/test_ghap.py::TestListGhapEntries::test_list_ghap_entries_default 2025-12-04 23:04:00 [info     ] ghap.entries_listed            count=0 filters={}
PASSED
tests/server/tools/test_ghap.py::TestListGhapEntries::test_list_ghap_entries_invalid_limit 2025-12-04 23:04:00 [warning  ] ghap.validation_error          error='Limit must be between 1 and 100 (got 0)'
PASSED
tests/server/tools/test_ghap.py::TestListGhapEntries::test_list_ghap_entries_invalid_domain 2025-12-04 23:04:00 [warning  ] ghap.validation_error          error="Invalid domain 'invalid'. Valid options: debugging, refactoring, feature, testing, configuration, documentation, performance, security, integration"
PASSED
tests/server/tools/test_ghap.py::TestListGhapEntries::test_list_ghap_entries_invalid_date 2025-12-04 23:04:00 [warning  ] ghap.validation_error          error="Invalid date format for 'since': not a date. Expected ISO 8601 format (e.g., '2024-01-15T10:30:45+00:00')"
PASSED
tests/server/tools/test_git.py::test_search_commits_not_available 2025-12-04 23:04:00 [info     ] git.search_commits             author=None query=test
PASSED
tests/server/tools/test_git.py::test_get_file_history_not_available 2025-12-04 23:04:00 [info     ] git.file_history               limit=100 path=test.py
PASSED
tests/server/tools/test_git.py::test_get_churn_hotspots_not_available 2025-12-04 23:04:00 [info     ] git.churn_hotspots             days=90 limit=10
PASSED
tests/server/tools/test_git.py::test_get_code_authors_not_available 2025-12-04 23:04:00 [info     ] git.code_authors               path=test.py
PASSED
tests/server/tools/test_git.py::test_search_commits_empty_query 2025-12-04 23:04:00 [info     ] git.search_commits             author=None query='   '
PASSED
tests/server/tools/test_git.py::test_search_commits_limit_validation 2025-12-04 23:04:00 [info     ] git.search_commits             author=None query=test
2025-12-04 23:04:00 [info     ] git.search_commits             author=None query=test
PASSED
tests/server/tools/test_git.py::test_search_commits_invalid_date_format 2025-12-04 23:04:00 [info     ] git.search_commits             author=None query=test
PASSED
tests/server/tools/test_git.py::test_get_file_history_limit_validation 2025-12-04 23:04:00 [info     ] git.file_history               limit=0 path=test.py
2025-12-04 23:04:00 [info     ] git.file_history               limit=501 path=test.py
PASSED
tests/server/tools/test_git.py::test_get_file_history_file_not_found 2025-12-04 23:04:00 [info     ] git.file_history               limit=100 path=nonexistent.py
PASSED
tests/server/tools/test_git.py::test_get_churn_hotspots_days_validation 2025-12-04 23:04:00 [info     ] git.churn_hotspots             days=0 limit=10
2025-12-04 23:04:00 [info     ] git.churn_hotspots             days=366 limit=10
PASSED
tests/server/tools/test_git.py::test_get_churn_hotspots_limit_validation 2025-12-04 23:04:00 [info     ] git.churn_hotspots             days=90 limit=0
2025-12-04 23:04:00 [info     ] git.churn_hotspots             days=90 limit=51
PASSED
tests/server/tools/test_git.py::test_get_code_authors_file_not_found 2025-12-04 23:04:00 [info     ] git.code_authors               path=nonexistent.py
PASSED
tests/server/tools/test_learning.py::TestGetClusters::test_get_clusters_success 2025-12-04 23:04:00 [info     ] learning.clusters_retrieved    axis=full count=2 noise_count=7
PASSED
tests/server/tools/test_learning.py::TestGetClusters::test_get_clusters_invalid_axis 2025-12-04 23:04:00 [warning  ] learning.error                 error="Invalid axis 'invalid'. Valid options: full, strategy, surprise, root_cause"
PASSED
tests/server/tools/test_learning.py::TestGetClusters::test_get_clusters_insufficient_data 2025-12-04 23:04:00 [warning  ] learning.error                 error='Not enough experiences for clustering. Found 15, need at least 20.'
PASSED
tests/server/tools/test_learning.py::TestGetClusterMembers::test_get_cluster_members_success 2025-12-04 23:04:00 [error    ] learning.unexpected_error      error="object MagicMock can't be used in 'await' expression" tool=get_cluster_members
[31m[0m[31m[0m[31m [0m[1;31mTraceback [0m[1;2;31m(most recent call last)[0m[31m [0m[31m[0m[31m[0m
[31m[0m [2m/Users/elliotmilco/Documents/GitHub/clams/.worktrees/SPEC-002-16/src/learnin[0m [31m[0m
[31m[0m [2mg_memory_server/server/tools/[0m[1mlearning.py[0m:178 in get_cluster_members          [31m[0m
[31m[0m                                                                              [31m[0m
[31m[0m   [2m175 [0m[2m         [0mcollection = [33mf[0m[33m"[0m[33mghap_[0m[33m{[0maxis[33m}[0m[33m"[0m                                [31m[0m
[31m[0m   [2m176 [0m[2m         [0m                                                           [31m[0m
[31m[0m   [2m177 [0m[2m         [0m[2m# Cluster label is stored in payload metadata[0m              [31m[0m
[31m[0m [31m [0m178 [2m         [0mresults = [94mawait[0m vector_store.scroll(                       [31m[0m
[31m[0m   [2m179 [0m[2m            [0mcollection=collection,                                 [31m[0m
[31m[0m   [2m180 [0m[2m            [0mlimit=limit,                                           [31m[0m
[31m[0m   [2m181 [0m[2m            [0mfilters={[33m"[0m[33mcluster_label[0m[33m"[0m: label},                      [31m[0m
[31m[0m                                                                              [31m[0m
[31m[0m [34m[0m[34m[0m[34m locals [0m[34m[0m[34m[0m [31m[0m
[31m[0m [34m[0m         [3;33maxis[0m[31m =[0m [32m'full'[0m                                                    [34m[0m [31m[0m
[31m[0m [34m[0m   [3;33mcluster_id[0m[31m =[0m [32m'full_0'[0m                                                  [34m[0m [31m[0m
[31m[0m [34m[0m   [3;33mcollection[0m[31m =[0m [32m'ghap_full'[0m                                               [34m[0m [31m[0m
[31m[0m [34m[0m            [3;33me[0m[31m =[0m [1;35mTypeError[0m[1m([0m[32m"object MagicMock can't be used in 'await' [0m     [34m[0m [31m[0m
[31m[0m [34m[0m                [32mexpression"[0m[1m)[0m                                              [34m[0m [31m[0m
[31m[0m [34m[0m        [3;33mlabel[0m[31m =[0m [1;36m0[0m                                                         [34m[0m [31m[0m
[31m[0m [34m[0m        [3;33mlimit[0m[31m =[0m [1;36m50[0m                                                        [34m[0m [31m[0m
[31m[0m [34m[0m        [3;33mparts[0m[31m =[0m [1m[[0m[32m'full'[0m, [32m'0'[0m[1m][0m                                             [34m[0m [31m[0m
[31m[0m [34m[0m [3;33mvector_store[0m[31m =[0m [1m<[0m[1;95mMagicMock[0m[39m [0m[33mid[0m[39m=[0m[32m'4911246528'[0m[1m>[0m                               [34m[0m [31m[0m
[31m[0m [34m[0m [31m[0m
[31m[0m
[1;91mTypeError: [0mobject MagicMock can't be used in [32m'await'[0m expression

FAILED

=================================== FAILURES ===================================
____________ TestGetClusterMembers.test_get_cluster_members_success ____________

self = <tests.server.tools.test_learning.TestGetClusterMembers object at 0x1248b5790>
registered_tools = <MagicMock id='4911238704'>

    @pytest.mark.asyncio
    async def test_get_cluster_members_success(
        self, registered_tools: MagicMock
    ) -> None:
        """Test successful cluster member retrieval."""
        tool = registered_tools.tools["get_cluster_members"]
        result = await tool(cluster_id="full_0")
    
>       assert "error" not in result
E       AssertionError: assert 'error' not in {'error': {'type': 'internal_error', 'message': 'Internal server error'}}

tests/server/tools/test_learning.py:163: AssertionError
=============================== warnings summary ===============================
tests/clustering/test_clusterer.py: 208 warnings
tests/clustering/test_experience.py: 22 warnings
tests/clustering/test_integration.py: 10 warnings
  /Users/elliotmilco/Documents/GitHub/clams/.worktrees/SPEC-002-16/.venv/lib/python3.12/site-packages/sklearn/utils/deprecation.py:132: FutureWarning: 'force_all_finite' was renamed to 'ensure_all_finite' in 1.6 and will be removed in 1.8.
    warnings.warn(

-- Docs: https://docs.pytest.org/en/stable/how-to/capture-warnings.html
=========================== short test summary info ============================
FAILED tests/server/tools/test_learning.py::TestGetClusterMembers::test_get_cluster_members_success - AssertionError: assert 'error' not in {'error': {'type': 'internal_error', 'message': 'Internal server error'}}
!!!!!!!!!!!!!!!!!!!!!!!!!! stopping after 1 failures !!!!!!!!!!!!!!!!!!!!!!!!!!!
====== 1 failed, 335 passed, 2 skipped, 240 warnings in 64.72s (0:01:04) =======
